<?xml version="1.0" encoding="UTF-8" ?>
<xs:schema xmlns:xs="http://www.w3.org/2001/XMLSchema">

    <xs:element name="registerEX">
        <xs:complexType>
            <xs:sequence>
                <xs:element name="man" minOccurs="0" maxOccurs="200">
                    <xs:complexType>
                        <xs:sequence>
                            <xs:element name="initials">
                                <xs:simpleType>
                                    <xs:restriction base="xs:string">
                                        <xs:pattern value="([a-zA-Z\s]*){3}"/>
                                    </xs:restriction>
                                </xs:simpleType>
                            </xs:element>
                            <xs:element name="status">
                                <xs:simpleType>
                                    <xs:restriction base="xs:string">
                                        <xs:enumeration value="ex"/>
                                        <xs:enumeration value="current"/>
                                        <xs:enumeration value="future"/>
                                    </xs:restriction>
                                </xs:simpleType>
                            </xs:element>
                            <xs:element name="email">
                                <xs:simpleType>
                                    <xs:restriction base="xs:string">
                                        <xs:pattern value="([0-9a-zA-Z]([-_.\w]*[0-9a-zA-Z])*@([0-9a-zA-Z][-_\w]*[0-9a-zA-Z]\.)+[a-zA-Z]{2,9})"/>
                                    </xs:restriction>
                                </xs:simpleType>
                            </xs:element>
                            <xs:element name="color_of_hair">
                                <xs:simpleType>
                                    <xs:restriction base="xs:string">
                                        <xs:enumeration value="blond"/>
                                        <xs:enumeration value="brown"/>
                                        <xs:enumeration value="black"/>
                                        <xs:enumeration value="ginger red"/>
                                    </xs:restriction>
                                </xs:simpleType>
                            </xs:element>
                            <xs:element name="color_of_eyes">
                                <xs:simpleType>
                                    <xs:restriction base="xs:string">
                                        <xs:enumeration value="blue"/>
                                        <xs:enumeration value="gray"/>
                                        <xs:enumeration value="green"/>
                                    </xs:restriction>
                                </xs:simpleType>
                            </xs:element>
                            <xs:element name="height">
                                <xs:simpleType>
                                    <xs:restriction base="xs:integer">
                                        <xs:minInclusive value="55"/>
                                        <xs:maxInclusive value="280"/>
                                    </xs:restriction>
                                </xs:simpleType>
                            </xs:element>
                        </xs:sequence>
                    </xs:complexType>
                </xs:element>
            </xs:sequence>
            <xs:attribute name="orderid" type="xs:string" use="required"/>
        </xs:complexType>
    </xs:element>

</xs:schema>